"Category Merge","Kategorien vereinen"
"Is Active","Aktiv"
"Merge to and delete current","Mit Zielkategorie vereinen und diese löschen"
"Merge to and keep current","Mit Zielkategorie vereinen und diese behalten"
"Merge into current and delete source","In diese Kategorie vereinen und Quelle löschen"
"Merge into current and keep source","In diese Kategorie vereinen und Quelle behalten"
"Category merge failed","Vereinen der Kategorien fehlgeschlagen"
"Your categories have been merged successfully","Kategorien erfolgreich zusammengeführt"
"Action From","Aktion von"
"Action To","Aktion nach"